{
  "reachable": false,
  "plane_change_dv_ms": 41.2,
  "sso_consistency_warning": null,
  "windows": [],
  "constants_block": {
    "J2": 0.00108262668,
    "GM": 398600441800000.0,
    "R_e": 6378137.0,
    "omega_sid_rad_s": 7.292115e-05,
    "gmst_model": "IAU_1982",
    "citation_id": "run_20261003_7f3a91c2",
    "source": {
      "J2": "spec II.10 constants table",
      "GM": "spec II.10 constants table",
      "R_e": "spec II.10 constants table",
      "omega_sid_rad_s": "spec II.10 constants table",
      "gmst_model": "spec IV constants_block"
    }
  },
  "provenance_block": {
    "site": {
      "name": "canso"
    },
    "corridor": {
      "A_min_deg": 100.0,
      "A_max_deg": 140.0
    },
    "criteria_version": "v1",
    "vehicle_profile_id": "cyclone4m",
    "row_flags": {
      "corridor_A_min_deg": "ASSUMPTION",
      "corridor_A_max_deg": "ASSUMPTION"
    },
    "source_files": [
      "backend/engine/data/site_canso.json",
      "backend/weather/data/criteria_v1.json"
    ]
  },
  "engine_version": "engine-0.1.0",
  "computation_ms": 6.4
}
